[
  {
    "algorithm_version": "asa-astro-reasoning-poc-0.1.0",
    "asa_dependency_status": "unavailable_not_consumed",
    "centrality_termination": {
      "converged": false,
      "iterations": 64,
      "maximum_iterations": 64
    },
    "component_contributions": {
      "betweenness": {
        "contribution": 0.0,
        "normalised_value": 0.0,
        "raw_value": 0.0,
        "weight": 0.12
      },
      "containment_hierarchy": {
        "contribution": 0.030004100838,
        "normalised_value": 0.300041008384,
        "raw_value": 0.182724974106,
        "weight": 0.1
      },
      "eigenvector_influence": {
        "contribution": 0.007775679723,
        "normalised_value": 0.05554056945,
        "raw_value": 0.05554056945,
        "weight": 0.14
      },
      "evidence_support": {
        "contribution": 0.056949375,
        "normalised_value": 0.40678125,
        "raw_value": 0.268475625,
        "weight": 0.14
      },
      "relationship_persistence": {
        "contribution": 0.021267061491,
        "normalised_value": 0.212670614905,
        "raw_value": 0.24326424393,
        "weight": 0.1
      },
      "structural_dependency": {
        "contribution": 0.023767784731,
        "normalised_value": 0.237677847311,
        "raw_value": 0.230444717663,
        "weight": 0.1
      },
      "typed_degree": {
        "contribution": 0.09,
        "normalised_value": 0.75,
        "raw_value": 3.0,
        "weight": 0.12
      },
      "weighted_connectivity": {
        "contribution": 0.035926242109,
        "normalised_value": 0.199590233938,
        "raw_value": 0.438492411551,
        "weight": 0.18
      }
    },
    "confidence_adjustment": 0.325425,
    "epistemic_classification": "computed",
    "id": "standing-1df40bbdee33d5b38874",
    "input_graph_sha256": "a90d5f1dacef04fa0656c2d5f1dec6b061298893058bf57034c9af7d129c227b",
    "input_provenance_sha256": "188921cdf8cd52940f844b3af4aed21d409559d09ed99920bd7a6480e7e84e59",
    "ontology_version": "ASTRO-ONTOLOGY-0001",
    "policy": {
      "asa_dependency_status": "unavailable_not_consumed",
      "authority_status": "provisional_non_canonical",
      "centrality_max_iterations": 64,
      "centrality_tolerance": 1e-12,
      "component_weights": {
        "betweenness": 0.12,
        "containment_hierarchy": 0.1,
        "eigenvector_influence": 0.14,
        "evidence_support": 0.14,
        "relationship_persistence": 0.1,
        "structural_dependency": 0.1,
        "typed_degree": 0.12,
        "weighted_connectivity": 0.18
      },
      "normalisation_method": "max",
      "notes": [
        "Proof-of-concept hypothesis only; not an ASA Standing contract.",
        "No Context field is consumed by this policy.",
        "Encoded brightness, pixel area, and candidate class are excluded."
      ],
      "policy_id": "standing-policy-provisional-0001",
      "policy_version": "0.1.0",
      "uncertainty_penalty_weight": 0.35
    },
    "provenance_refs": [
      "evidence-907dd5f14be7be2574ee",
      "provenance-d835245d6645c4394ff4"
    ],
    "raw_score": 0.265690243892,
    "record_status": "active",
    "schema_version": "0.1.0",
    "score": 0.066048402878,
    "subject_id": "candidate-07b1065c39228d6d1340",
    "taxonomy_version": "ASTRO-RELATIONSHIP-TAXONOMY-0001",
    "uncertainty_penalty": 0.23610125,
    "warnings": [
      "Provisional non-canonical Standing hypothesis; DR-0001 and DR-0009 remain open."
    ]
  },
  {
    "algorithm_version": "asa-astro-reasoning-poc-0.1.0",
    "asa_dependency_status": "unavailable_not_consumed",
    "centrality_termination": {
      "converged": false,
      "iterations": 64,
      "maximum_iterations": 64
    },
    "component_contributions": {
      "betweenness": {
        "contribution": 0.0,
        "normalised_value": 0.0,
        "raw_value": 0.0,
        "weight": 0.12
      },
      "containment_hierarchy": {
        "contribution": 0.0,
        "normalised_value": 0.0,
        "raw_value": 0,
        "weight": 0.1
      },
      "eigenvector_influence": {
        "contribution": 9.2708307e-05,
        "normalised_value": 0.00066220219,
        "raw_value": 0.00066220219,
        "weight": 0.14
      },
      "evidence_support": {
        "contribution": 0.0778918,
        "normalised_value": 0.55637,
        "raw_value": 0.3672042,
        "weight": 0.14
      },
      "relationship_persistence": {
        "contribution": 0.001342946976,
        "normalised_value": 0.013429469763,
        "raw_value": 0.015361359677,
        "weight": 0.1
      },
      "structural_dependency": {
        "contribution": 0.0,
        "normalised_value": 0.0,
        "raw_value": 0,
        "weight": 0.1
      },
      "typed_degree": {
        "contribution": 0.03,
        "normalised_value": 0.25,
        "raw_value": 1.0,
        "weight": 0.12
      },
      "weighted_connectivity": {
        "contribution": 0.003595930787,
        "normalised_value": 0.01997739326,
        "raw_value": 0.043889599076,
        "weight": 0.18
      }
    },
    "confidence_adjustment": 0.445096,
    "epistemic_classification": "computed",
    "id": "standing-ace4b6d4f5e6c5c755e8",
    "input_graph_sha256": "a90d5f1dacef04fa0656c2d5f1dec6b061298893058bf57034c9af7d129c227b",
    "input_provenance_sha256": "188921cdf8cd52940f844b3af4aed21d409559d09ed99920bd7a6480e7e84e59",
    "ontology_version": "ASTRO-ONTOLOGY-0001",
    "policy": {
      "asa_dependency_status": "unavailable_not_consumed",
      "authority_status": "provisional_non_canonical",
      "centrality_max_iterations": 64,
      "centrality_tolerance": 1e-12,
      "component_weights": {
        "betweenness": 0.12,
        "containment_hierarchy": 0.1,
        "eigenvector_influence": 0.14,
        "evidence_support": 0.14,
        "relationship_persistence": 0.1,
        "structural_dependency": 0.1,
        "typed_degree": 0.12,
        "weighted_connectivity": 0.18
      },
      "normalisation_method": "max",
      "notes": [
        "Proof-of-concept hypothesis only; not an ASA Standing contract.",
        "No Context field is consumed by this policy.",
        "Encoded brightness, pixel area, and candidate class are excluded."
      ],
      "policy_id": "standing-policy-provisional-0001",
      "policy_version": "0.1.0",
      "uncertainty_penalty_weight": 0.35
    },
    "provenance_refs": [
      "evidence-2e443f9084baa9ea8d24",
      "provenance-d835245d6645c4394ff4"
    ],
    "raw_score": 0.11292338607,
    "record_status": "active",
    "schema_version": "0.1.0",
    "score": 0.040500091799,
    "subject_id": "candidate-0ccc75b8cc6c67f7ea59",
    "taxonomy_version": "ASTRO-RELATIONSHIP-TAXONOMY-0001",
    "uncertainty_penalty": 0.1942164,
    "warnings": [
      "Provisional non-canonical Standing hypothesis; DR-0001 and DR-0009 remain open."
    ]
  },
  {
    "algorithm_version": "asa-astro-reasoning-poc-0.1.0",
    "asa_dependency_status": "unavailable_not_consumed",
    "centrality_termination": {
      "converged": false,
      "iterations": 64,
      "maximum_iterations": 64
    },
    "component_contributions": {
      "betweenness": {
        "contribution": 0.0,
        "normalised_value": 0.0,
        "raw_value": 0.0,
        "weight": 0.12
      },
      "containment_hierarchy": {
        "contribution": 0.042672413793,
        "normalised_value": 0.426724137931,
        "raw_value": 0.259875,
        "weight": 0.1
      },
      "eigenvector_influence": {
        "contribution": 0.025750535315,
        "normalised_value": 0.183932395109,
        "raw_value": 0.183932395109,
        "weight": 0.14
      },
      "evidence_support": {
        "contribution": 0.07875,
        "normalised_value": 0.5625,
        "raw_value": 0.37125,
        "weight": 0.14
      },
      "relationship_persistence": {
        "contribution": 0.03739108236,
        "normalised_value": 0.373910823596,
        "raw_value": 0.427699585294,
        "weight": 0.1
      },
      "structural_dependency": {
        "contribution": 0.035109495767,
        "normalised_value": 0.351094957673,
        "raw_value": 0.3404102625,
        "weight": 0.1
      },
      "typed_degree": {
        "contribution": 0.09,
        "normalised_value": 0.75,
        "raw_value": 3.0,
        "weight": 0.12
      },
      "weighted_connectivity": {
        "contribution": 0.069187975081,
        "normalised_value": 0.384377639341,
        "raw_value": 0.844463552625,
        "weight": 0.18
      }
    },
    "confidence_adjustment": 0.45,
    "epistemic_classification": "computed",
    "id": "standing-77d5b12656641aab8a5b",
    "input_graph_sha256": "a90d5f1dacef04fa0656c2d5f1dec6b061298893058bf57034c9af7d129c227b",
    "input_provenance_sha256": "188921cdf8cd52940f844b3af4aed21d409559d09ed99920bd7a6480e7e84e59",
    "ontology_version": "ASTRO-ONTOLOGY-0001",
    "policy": {
      "asa_dependency_status": "unavailable_not_consumed",
      "authority_status": "provisional_non_canonical",
      "centrality_max_iterations": 64,
      "centrality_tolerance": 1e-12,
      "component_weights": {
        "betweenness": 0.12,
        "containment_hierarchy": 0.1,
        "eigenvector_influence": 0.14,
        "evidence_support": 0.14,
        "relationship_persistence": 0.1,
        "structural_dependency": 0.1,
        "typed_degree": 0.12,
        "weighted_connectivity": 0.18
      },
      "normalisation_method": "max",
      "notes": [
        "Proof-of-concept hypothesis only; not an ASA Standing contract.",
        "No Context field is consumed by this policy.",
        "Encoded brightness, pixel area, and candidate class are excluded."
      ],
      "policy_id": "standing-policy-provisional-0001",
      "policy_version": "0.1.0",
      "uncertainty_penalty_weight": 0.35
    },
    "provenance_refs": [
      "evidence-3cd3b936a35065b52ad8",
      "provenance-d835245d6645c4394ff4"
    ],
    "raw_score": 0.378861502317,
    "record_status": "active",